ID	SENTIMENT	TEXT
270_ 3	positive	The sound quality is excellent and the speaker phone couldn't be easier to use.
29_ 2	neutral	I am no computer expert, and this is my first (and probably last) digital camera.
132_ 150	neutral	 a week passed but it was never picked up.
132_ 45	positive	 Very sturdy and strong.
136_ 21	neutral	So 54 Megabytes per second is about a thousand times faster than a standard modem.
181_ 5	negative	Most of us just want to plug and play, not spend a year navigating a maze of complicated options...like transfering everything on a hard drive to this stupid thing.
132_ 63	neutral	 You can also use it as an external hard drive to back-up documents, photographs, etc.
132_ 24	neutral	 There is an alarm and timer, but most MP3 players have this feature.
270_ 6	negative	The only problem is the size of the keys.
139_ 11	neutral	On the subject of Third Party firmware; Linksys WRT54G versions 1 through 4 run Linux.
15_ 18	negative	The pictures are a little dark sometimes.
0_ 205	neutral	I have not been this happy about a purchase I have made in a long time.
169_ 0	neutral	I purchased the WRT54G about a week ago.
241_ 9	negative	The only problem is that occasionally the joystick does start to dig into your thumb while gaming.
0_ 143	neutral	If you like to take a look at some pictures shot with this camera by a mediocre photographer please feel fee to check out my picture page at http://community.webshots.com/user/mbs60099
132_ 126	neutral	  This is a hassle, of course, but I'm not sure if the problems are to blame on poor construction, cold weather, or misuse by yours truly.
102_ 1	positive	From the Internet, woodworking books, local stores and personal opinions the Hitachi M12V 3-1/4 HP router time and time again came up to be the router of choice or best for its price.
132_ 527	neutral	Or simply rate its performance in relation to other products?
106_ 10	neutral	Accessories included in the package are: - 1/2" shank, 1/2" diameter, 1" cutting length, 2 carbide flute straight bit - parallel guide - template guide - template adapter for 3rd-party guides - 1/4" chuck sleeve - cutting depth fine adjustment knob (which takes a "13 mm" wrench to install, but a crescent wrench works OK too)
213_ 9	neutral	Aren't they something of digital sound experts?
242_ 31	positive	The 6600 (T-Mobile) is the true 'world phone' in that it has the mhz to operate around the globe, including New Zealand and Australia (900) whereas the  6620 (available from Cingular) replaces it w/ 800mhz (some refer to as 850).
256_ 15	positive	Probably a great phone overall, and perhaps mine just has bugs.
298_ 33	negative	Just the home version of Norton Internet/AV has too many glitches and problems to even remotely bother with.
279_ 7	positive	I am just in love with this phone, especially after using a more primitve phone about 3 years.
306_ 1	negative	I read many reviews on Norton I.S. 2004 from a variety of sources (Cnet, Amazon, message boards) and came to the conclusion that NIS 04 was a terrible product and not worth the update.
189_ 33	neutral	Now, about the iTunes.
233_ 7	neutral	My dad has a Nokia 6670 before which he has a Nokia 7210 and before that he had a Nokia 6610.
194_ 4	positive	It holds plenty of songs.
0_ 216	positive	I have a Canon A 70 , and now this SD500, its amazing, how this little camera produces, such great pics, it even brings out ur pimples on the face.
163_ 2	neutral	They've gone from 16 MB of RAM in version 4 to 8 MB of RAM in version 5.
166_ 1	neutral	Networking computers is quite beyond the capabilities of those, who used to think you had to keep the TV on to record it from your VCR.
183_ 24	neutral	If you want a wall-socket recharging cord, you have to dish out somewhere between $30 and $35, plus shipping and handling, for a cord that cost less than $1 to manufacture and market.
139_ 23	neutral	If you are a tech person and want to really play with your WRT54G, sorry, but you need to get the WRT54GS router.
242_ 15	positive	I've had no problems w/ this phone.
276_ 4	negative	DOwnside is the size of the phone, it is BIG for today's standard.
213_ 12	neutral	before i get into the cons, i'll make a note about the scrollpad.
263_ 12	neutral	the stand by is really good considering all the toys this phone has and the screen size!
119_ 7	positive	You just can't go wrong with this one!
132_ 251	neutral	 I mean, it would be nice if one day, iTunes can actually offer their customers a monthly service that allows iPod owners to load their iPods up with unlimited music with one set fee, as an option to the pay-99cents-a-track path.
193_ 24	positive	It was also the most appealing.
5_ 9	negative	This is due to the unusually slow autofocus system.
136_ 35	neutral	Hope this helps.
127_ 6	negative	Two, the single wrench just doesn't work well.
304_ 3	positive	Anyhow, this software is working fine and no problems since I installed it two weeks ago.
166_ 53	neutral	What about the wireless capability, you ask.
193_ 50	neutral	My hobby is home audio and home theater.
221_ 24	neutral	And the price?
91_ 12	negative	CONS - Difficult to open to change bag-twice my bags caught on a sharp edge inside and snagged as I was pulling out-leaving dirty diapers all over the floor.
195_ 41	positive	FM transmitter (belkin has a good one) to use Zen with your car Sterio FM Tunner   Latest Find: Connected this baby to my $3800 audiophile audio system and it produced clean sound compared to Ipod.
100_ 1	positive	This is really a nice diaper pail.
184_ 2	positive	Smaller size, 1 gb of more space, radio, voice recording, removable battery, cooler look, all in one.
43_ 0	positive	I've had this camera just over 2 years and it takes pretty good pictures.
35_ 19	positive	The manual modes give you a lot of control over exposure and white balance (but there is no manual focus or manual exposure).
251_ 7	negative	2- It is bulky and the small buttons on the sides are sloppy to use .
89_ 1	positive	I decided to go with the Diaper Champ rather than the more popular Diaper Genie, because I didn't like the idea of having to buy special bags.
0_ 52	neutral	All had the same results.
209_ 27	neutral	You may need to briefly disable various spam blockers, cookie swatters, and antivirus programs (I know, I know -- get offline first).
253_ 2	neutral	So, do I recommend the 6600?
132_ 410	neutral	 With both pairs I had ceramic rattling in my ears by month two.
23_ 3	neutral	In practice, we've been VERY happy with the results.
104_ 3	negative	If you think you are saving $40 getting the Hitachi, you are right, and you are also getting a router worth $40 less than a Makita.
128_ 0	neutral	I use the Hitachi M12V in a router table.
105_ 5	positive	So for the money it costs for one of those top-of-the-line models I've got a good router & a nice table to put it in & I like that.
0_ 156	positive	As it turns out, this is an awesome camera!
249_ 7	neutral	The ONLY bad thing?
287_ 38	negative	Once again it won't reinstall, even with online and email assistance from Symantect Technicians.
183_ 44	negative	As I wrote, this COULD have been a great product, but expect hidden charges (read gross profiteering and price gouging) as the company royally sticks you on every conceivable accessory necessary for normal daily usage.
0_ 159	neutral	CNET told you not to look for advanced controls.
17_ 2	negative	The new drivers on cannon's site do not help at all but try them if you want they have made me have to use the backup software.
298_ 14	neutral	The SystemWorks 2005 seems to be working GREAT!!
198_ 3	neutral	I emailed the company and after 2 days was told to read their Q&A site and then download again.
264_ 1	positive	Camera quality isn't bad for the low resolution.
99_ 5	neutral	We just bought another for baby boy number two coming next month.
5_ 1	positive	It has given me zero problems, and the more I use it, the better I become at taking advantage of its strengths.
242_ 37	positive	It films 10 second video, for crying out loud.
189_ 44	neutral	But if you get that "fuzzy legal feeling" from paying for songs, at least buy them from allofmp3.com, there are no restrictions and the songs cost pennies.
287_ 26	positive	These tasks are faster and easier than in prior versions, and I found the menu to be much more navigable.
58_ 0	neutral	My daughter is now 2 and 1/2, and I am still enjoying this product.
211_ 18	neutral	But after a few firmware releases it's working without a hitch.
110_ 15	positive	Less than a cheap cordless drill or a laminate trimmer.
74_ 1	positive	I use the same store-brand tall kitchen trash bags I already use in the kitchen for it -- no special "diaper" trash bags necessary.
203_ 4	negative	Screen review could be better.
263_ 5	negative	the OS is abit confusing at 1st, but within a few days you will pass this learning curve!
208_ 11	negative	On the downside, I think the interface takes some getting used to and the Zen software !
216_ 3	neutral	This is by far my biggest complaint.
16_ 3	negative	The price is $... more.
166_ 40	neutral	Ok, so what can we say about this particular network product?
281_ 7	negative	I have never had this problem with any other software on my computer.
268_ 4	positive	One primary reason for getting a cell phone was so that I could use it as an internet connection for my laptop running linux, where softmodem drivers are hard to find, and don't work very well.
85_ 3	neutral	Only problem.
220_ 15	positive	Have not had any issues with the headphones or fragility.
189_ 1	neutral	If you're not computer savvy or if you want things as simple as they can be, get the iPod.
281_ 4	negative	During install, NIS would either freeze or not reboot properly when asked to do so.
54_ 9	positive	We use the cheap $1.99 13 gallon vanilla scented bags from the grocery store but you can use any bag you have laying around.
100_ 8	positive	We just use the Glad tall kitchen trash can bags with odor shield from Target and they work wonderfully.
67_ 3	neutral	Presto!
5_ 7	negative	Its size makes holding it steady for long a bit of a challenge (not enough camera body to grip with more than your finger tips).
233_ 42	neutral	Did I mention the note feature and how you can send notes via Bluetooth?
132_ 475	neutral	 The first time I took it in the car, and was able to chose from hundreds of CD titles, thousands of songs, to have all of that at my fingertips was a great experience.
268_ 17	neutral	Apparently some phones don't allow you to give an entire group a ringtone.
195_ 12	neutral	Zen micro does.
169_ 14	neutral	There is also a Panasonic cordless phone (2.4 Ghz) between the wap and the ethernet bridge but it never causes a problem.
174_ 7	neutral	Netgear and Dell (which I think may be DLink rebranded) do.
132_ 261	neutral	 It "feels" much more professional and well built - the clickable scroller, for example, is a brilliant invention and I never feel as if I'm going to perhaps break it or snap it off (as I sometimes did with the Nitrus).
82_ 0	positive	It holds almost a week's worth of diapers, and you don't need expensive refills - any kitchen bags work.
171_ 4	negative	Stay away from this junk.
138_ 22	positive	I'd give it 4.5 stars if possible, but since 5 stars would be misleading, I give it 4 stars.
132_ 124	negative	 First, let me say that I got the 20gb iPod for Christmas, and I most likely would not have spent the $300 myself.
214_ 11	positive	And I must say...this MP3 is very cool.
132_ 271	neutral	 My only nitpick with this is that it sometimes doesn't work on certain files and presents error messages.
41_ 0	neutral	My first impression of Elph S100 was that there couldn't POSSIBLY be room in the thing for anything other than a battery and a memory card.
128_ 3	positive	I like the speed control.
180_ 2	neutral	It's very frustrating to try to complete school work or work, only to lose it because I am dropped every couple of minutes.
179_ 13	neutral	All this took a couple of hours fidling, as I did not go to Linksys website for support - so I wouldn't know if there is help there.
132_ 418	neutral	A lot of the reviews I've read talk about IPODS in general.
15_ 3	neutral	On a battery charge, the camera takes approximately 70 pictures, where the camera is opened and closed between pictures.
119_ 0	neutral	This router is 1 of 4 in my shop.
206_ 1	positive	This year, it seems that I choose my timing perfectly, having discovered the awesome device that is the Zen Micro.
248_ 5	neutral	Its like having a 66Mhz computer with a webcam, fax, printer, blue tooth...etc...Just an example..
270_ 17	positive	I recommend T-Mobile and the Nokia 6600 without reservation.
193_ 49	positive	At 128 the songs sound very good.
206_ 14	positive	Songs transfer lightning fast, and the two batteries that came in my box give me 24 hours of listen time.
142_ 9	neutral	Be sure to call your ISP with the modem's MAC address to get online.
189_ 26	positive	Record memos using the built in microphone.
275_ 2	neutral	i checked the iSync compatibility page and it was listed--they even had a photo of the 6600 shown in the graphic.
210_ 7	neutral	And t!
223_ 13	neutral	This was probably the biggest reason I chose the Micro over an iPod.
241_ 5	positive	Handset quality is great, as is the speakerphone quality and the headset audio quality.
0_ 174	positive	The included software removes any red eye easily.
233_ 30	neutral	Now that is neat.
291_ 3	negative	Stay away from this product!
35_ 3	positive	Even with the waterproof housing it is small.
255_ 11	neutral	In short, I don't have a single negative thing to say.
128_ 13	positive	The power, low noise operation, and speed control makes up for the problems I have experienced.
238_ 0	neutral	i bought this phone last march, almost a year ago, in saudi arabia (it came out there before it did here).
306_ 19	negative	Basically, I ate the cost of the renewal and ate the cost of the Tech Help.
129_ 1	neutral	Until recently it was my only router.
227_ 4	neutral	At the time of this writing, that firmware is a "beta release."
211_ 20	positive	The accesories that come with the player are great.
106_ 17	neutral	Bottom line: Highly recommended, but best when used in a table.
55_ 5	negative	My daughter is only 4 months old and we do notice an odor.
132_ 146	neutral	i didnt touch the product.
80_ 1	neutral	dirty diapes and soaked diapers.
126_ 0	neutral	I reciently purchased this when a 1 1/2hp plunge router (different name brand) couldn't hack it.
232_ 4	positive	Especially the LCD is big and the camera quality is among the very best around.
195_ 1	neutral	Space : 5GB =2500 songs.
132_ 31	neutral	 BATTERY LIFE: Pretty medicore at 12 hours, the Creative, iAudio, Rio, and iRiver players last longer.
225_ 48	neutral	If you send in your Zen to have the flaw fixed, you lose all of the music you've been loading into the thing for 2-3 months, which came out to 1022 songs and 80 albums for me.
187_ 18	positive	Utility Its got a huge list of features including an FM Recorder a Calender and contacts list.
105_ 4	neutral	Have to clean, buff & lube the plunge rods once in a while but I see that as a non issue because any router should be periodically cleaned anyway.
188_ 3	neutral	by broken i mean that it would no longer transmit sound.
129_ 5	negative	It would work fine for a while then as the motor warmed up it would die.
155_ 1	positive	As far as dealing with network access of other computers this router is pretty good given the price- remember this router is the same one that was released right when the G standard was introduced to the market.
85_ 1	positive	and we definitely prefer our Champ!
132_ 99	positive	Good sound-- Plays very nicely, even though the stock headphones are kind of weak Durable-- not the most durable because its mostly plastic, but very compact and sturdy
91_ 0	neutral	 We used this diaper pail from the day we brought our son home, until about 13 months.
25_ 9	positive	The pictures are uniformly excellent and color rendering is perfect.
193_ 28	positive	It has a cardboard slip cover with a nice layered box casing inside.
75_ 6	positive	There is no comparison, the chanp is easy and smell free, the genie was difficult to use one handed (which is absolutly vital if you have a little one on a changing pad) and there was a deffinite odor eminating from the genie plus we found that the quick tie garbage bags where the ties are integrated into the bag work really well because there isn't any added bulk around the sealing edge of the champ.
171_ 2	neutral	When that happens i have to restart my pc or restart the linksys router.
0_ 190	negative	Some adjustments in the settings could help make it better.
298_ 8	neutral	The tests were right.
113_ 4	positive	The depth adjustment and bit changing is much easier on the M12V than it was on my old router.
287_ 29	negative	Warning! The Windows "remove program" feature does not do a good job of this, and neither does Norton's own removal program.
190_ 23	negative	Even after all the nightmare sound problems, I'd still half-way like this product if it kept it's promise; the ability to store 1500 songs.
101_ 3	neutral	I tried it with the springs in and with them out and did not notice any difference.
132_ 239	neutral	The iPod does come with other nifty software accoutrements, but honestly I haven't used them much as I use the iPod to listen to music while I run or on a plane.
199_ 14	positive	I also like the fact that you can edit your MP3 titles, etc.
206_ 5	neutral	You ask, yup.
179_ 0	neutral	I tried and failed using the D-Link 624 108M wireless router.
31_ 12	neutral	It requires extensive Photoshopping to fix the flaws.
189_ 18	negative	This fixes some glitches such as the player freezing.
191_ 3	positive	I was fortunate to get the packaging that still included all the accessories (desk stand/hard case, belt clip, wall charger, etc).
242_ 6	negative	Even the instruction booklet is out of order.
0_ 163	positive	Bottom line, this camera will give you a lot of bang for the buck!
298_ 16	neutral	I hope it's better than this hunk of junk Internet/AV 2004 package.
232_ 3	positive	This one is full of features(has bluetooth).
132_ 55	positive	This new click wheel iPod allows you to navigate through the menus and song via a touch-wheel for scrolling and click-able buttons for selection.
313_ 9	neutral	Wish I hadn't renewed my subscription.
71_ 13	neutral	It lives up to its name.
242_ 42	negative	IMP: Two important pieces of advice - Visit Nokia's site.
279_ 0	positive	This phone is one of the milestones in the history of the cellular phones.
111_ 0	neutral	Bought an expensive Dewalt router some three years ago and never became comfortable with it.
229_ 0	positive	I have had several MP3 players over the past few years, and have to say that this by far is the best that I've owned.
263_ 8	positive	i also use the phone as my modem via bluetooth to my Apple powerbook!
192_ 1	neutral	I bought this a couple of months ago after researching all the reviews comparing with the iPod mini.
209_ 20	neutral	You quickly learn to brush your thumb ever so lightly over its surface.
311_ 7	negative	They said they would refund all the money, but a month later, they tell me now the back-up disc is not refundable as its cost is purely handling and shipping - $15 to "handle" and ship a CD? --and they have been indignant and combative on the phone and in emails.
79_ 23	positive	Regardless to this fact, I believe the Champ is the best way to go.
209_ 11	neutral	ts with Sennheiser HD-497 phones.
54_ 3	neutral	The bags never fit right and then it never spun right.
23_ 2	neutral	I'm a professional photographer using pro digital equipment and I was looking for something to have around the house so that my wife could capture candid moments with my kids.
279_ 6	positive	And also, since it is tri band and since it uses SIM-card, you can just use it in Europe and many other parts of the world, wherever GSM exists.
246_ 3	neutral	Same with the contacts list, recent call list and everything else.
156_ 1	positive	I just replaced my old Linksys router with this one, turned everything on in the right order, and it was up and running with no problems.
304_ 6	negative	Can't get easier than that!
275_ 8	neutral	i guess its my own fault for not researching more before buying the thing.
131_ 7	neutral	But, the first one just stopped working while pushing through the workpiece.
218_ 3	neutral	My big Zen has hundreds of CDs on it, but this little player will store my most listened to tunes, or songs Iwant to download for free from the Yahoo site, "test drive", then decide if I want to download permanently into my larger Creative.
174_ 9	neutral	SSID are like filenames in Windows.
133_ 7	neutral	I do not really know why some people are tearing this router !
82_ 3	neutral	I second that you just need to fold up the diaper (with wipes inside) neatly, but that is not a big deal.
311_ 13	neutral	While I understand the complaints about Symantec's Norton SystemWorks software suite (which are totally justified), the same can't be said for Norton Internet Security.
222_ 2	positive	The sound quality is superb, much better than that of an iPod, in my opinion.
139_ 2	neutral	You will not be able to run 100's users using WPA and WPA2 encryption through this thing, just a handful of people on a cable modem or DSL line.
187_ 4	neutral	The light pulsates when you are charging it almost as if it were breathing.
272_ 3	positive	This way I never have to be ripped off by the carrier for stupid ringtones, I can get whatever I want.
270_ 13	positive	I've had nothing but good luck with T-Mobile.
201_ 6	neutral	I waited a week to make the Micro worthy of a review.
132_ 148	neutral	 they initially told me that i would have to ship it back to them on my own cost.
322_ 7	positive	I downloaded a trial version of Computer Associates EZ Firewall and Antivirus and fell in love with a computer security system all over again.
289_ 1	negative	Then when I went to Norton's website to obtain a priority ID number per the instructions I had been given, I couldn't find a way to get one.
128_ 1	neutral	It is a little large for my table (Rockler), but that isn't the fault of the router.
215_ 7	positive	I thought the FM radio would not see much use with so many tracks avaiable to me, but its great for tuning in to TV programs at the gym while on the treadmill, concerts and programs being simulcast, NPR, and on and on.
26_ 0	positive	The good:  Small size; durable-seeming metal case; easy to use; visually distinctive; good picture quality; fast USB connection; mostly intuitive operation; really cool PhotoStitch software that knits pictures together to give wide panoramas.
166_ 22	neutral	from the cable modem you are using.
0_ 73	neutral	I don't miss the high speed program, nor the manual overide, since I had read numerous reviews and specs. before I ordered.
210_ 4	negative	I was up all night trying to make the stupid thing work, to no avail.
243_ 41	negative	Ultimately you will learn just how bad Nokia is, and why their recent loss of market share is so utterly deserved.
134_ 12	neutral	But can you decide to access the CD manual once you have started the Wizard?
218_ 5	positive	Feature for feature, I find it a very sweet little player; equipped with a higher end headphone system, between this and th larger Zen Ihardly use my home stereo system anymore.
0_ 121	neutral	However, it was not so in my case.
209_ 28	neutral	My gatekeeper programs kept fixes away a few times until I got wise to it.
97_ 3	negative	I gave up and got a diaper Dekor.
0_ 152	positive	As any digital camera owner knows is that when you go to take a picture of a moving object to expect some blurring but with some preliminary testing we had somone move there hands back and forth under the lense and another person take the picture and suprisingly a crystal clear image apeared on the decently sized screen.
304_ 5	negative	If you experience problems with installation, you can visit symantec's website, click the support tab, click the 'home or home office support' and there is an automated support assistant that can scan the Norton program files on your computer and it will tell you what is not working right and how to fix it.
174_ 14	neutral	MAC filtering isn't too hard and it is just a config change on the router.
213_ 8	positive	+Battery life is awesome IF you upgrade the firmware [requires a windows pc] OR make sure to always plug the ac adapter into the player before plugging into the outlet +Awesome sound quality... I mean it is Creative right?
0_ 90	neutral	i just thought it's cute and cool =)
278_ 0	positive	INCREDIBLE MEMORY!
322_ 2	negative	I had much of the same problems that everyone else has listed (mainly the SLOOOOOOOOOW processor), and then I couldn't get the damn thing off my computer completely!
132_ 421	neutral	I'm glad I did.
132_ 216	neutral	They wear out pretty easily when you're changing batteries every week or so.
35_ 9	negative	The auto color balance is often fooled by dense clouds.
15_ 10	positive	It fits in your pocket.
275_ 9	negative	but, i am quite unhappy with nokia at the moment.
95_ 0	positive	Diaper Champ is great.
0_ 123	neutral	Treating my cameras, past and present, with utmost care ensures my investment.
132_ 151	neutral	 the when i called they said they werent responsible for open packages because they couldnt verify it being open when i received it (why else would i want to return it if not for this? if the product was defective i would have complained so) and that if i returned it i would have to pay a 15% restocking fee!  i'm at my wits end with this company.
