ID	SENTIMENT	TEXT
184_ 5	positive	Creative Media Source is very easy to use once you get the hang of it, and the file transfers are fast.
166_ 46	positive	This model appears to be especially good.
132_ 194	neutral	 I was quite happy after months of saving part of my pay-check to go to the store and finally get an iPod.
228_ 10	positive	Further, the tech specs suggest that it has better audio quality than the Ipod.
301_ 1	neutral	I wish I'd done some research first....
213_ 21	negative	It has the odd side effect of the buttons only partially working?
280_ 5	negative	I am glad that I do not work for Norton.
132_ 504	neutral	  I use mine mostly at the gym, so this is fantastic for me.
32_ 14	neutral	And there are two more advantages to digital photography  which I hadn't anticipated, beyond the lack of film and developing.
273_ 3	negative	There is no way you can talk with customer care about this.
27_ 1	positive	The S100's image quality rates in the middle of its class, but it can still be a reasonable choice for students, families, or small businesses looking for an ultra-portable camera that weighs less than half a pound with media and battery pack.
106_ 9	negative	With the PlungeLIFT all my bit changing has been done above the table, although I still have to reach below the table to operate the spindle lock (and, of course, the speed and ON/OFF controls).
268_ 22	neutral	I'm used to having to restart things.
81_ 2	negative	We found that when you put a dirty diaper into the top loader, there was a tendency to get streaks which would then get on the plunger which would then have to get cleaned each time it was used.
87_ 2	positive	I can't smell anything (and believe me, this is quite something with my baby).
179_ 8	neutral	Then, the hardest bit was to figure out how to disable the router and the DHCP services so that all computers woul!
7_ 0	neutral	I have used many digital cameras.
183_ 25	negative	I have trashed this product on other opinion sites based on this major flaw alone.
108_ 1	neutral	The deal Amazon has going can't be beat and if you're considering buying this machine, do so from this site.
38_ 0	positive	I was looking for something that wasn't too complicated to use and to help the pics I post on Ebay show more detial.
36_ 19	neutral	9- Cons? Not a single one after 5 months.
132_ 96	neutral	12 hours is about average, and it has an AC adapter in the box, with quick charge (2 hours) at probably 80%... and 4 hours for a full charge.
155_ 5	neutral	Expect about 10MBps and not more though!
135_ 23	neutral	If you have a Mac, I don't think you should totally discount this product.
281_ 0	neutral	I have used Norton products in the past and I am familiar with them.
166_ 13	neutral	In some cases, you can't even get your PC to the MS patch site to download XP security patch #2 before being hit.
224_ 3	negative	(It had locked up multiple times previously, but always managed to work afterwards) This time, the touch screen wouldn't respond to me and none of the buttons worked.
302_ 3	positive	The popup blocker and anti-spam are bonuses.
246_ 7	positive	The camera and video functionality is decent, I can't see myself wasting my time with it, but some people will.
25_ 3	neutral	I especially like the way that ZoomBrowser EX lets you look at a virtual filmstrip of your pictures.
233_ 17	positive	Capacity is not a problem here.
234_ 11	neutral	You'll see what I mean ... if you have a magnifying glass.
287_ 23	neutral	Without this important feature, both SystemWorks and Internet Security are all but useless.
138_ 4	neutral	And the router itself had protective tape over the Ethernet inputs.
0_ 95	neutral	but it's good enough since i upload them to the computer anyway (and sound is good too once you view it on the computer/tv).
132_ 51	neutral	How did we listen to music before it?
260_ 0	positive	This phone is fantastic.
0_ 105	neutral	The pictures tend to get blurry due to longer exposure, but his can be disabled in the manual settings.
248_ 3	negative	The menu pops up after 3 seconds The picture takes a while to load from its slow card memory.
184_ 7	positive	This is the mp3 player with everything I need.  As long as it lasts me a good three years, I'm satisfied.
190_ 2	neutral	Mp3 players are like a blessing and a curse for people like me.
154_ 5	neutral	The whole process was probably about 10 minutes.
227_ 12	negative	The subscription files are still a little slower to transfer, but it's only by about 10% or so.
132_ 74	positive	  Plus, if you order from Amazon.com, they will exchange it for you no problem.
0_ 104	negative	Only downside is when taking pictures in low-light conditions without the flash.
105_ 2	negative	I built my own router table with a tilt up top & made a hand crank to replace the height adjustment knob & these two things make it easy to change out & raise or lower the bits.
132_ 320	neutral	However, after holding an ipod at circuit city, I knew I had to have one.
225_ 32	neutral	The features this thing has are !
96_ 1	positive	It works easily with one hand, which is important.
132_ 324	neutral	 For this reason, it is very easy to drop.
58_ 3	positive	1. It uses regular garbage bags instead of brand refills.
69_ 4	neutral	For even better odor control we would put a plug ins in the outlet closest to it.
186_ 0	neutral	I've been looking for a portable MP3 player for awhile now.
91_ 7	negative	Then it started to smell whether there were diapers in it or not.
214_ 30	neutral	PS.
54_ 8	positive	There are no specail bags to deal with or buy!
93_ 6	positive	We use regular kitchen sized garbage bags.
132_ 200	neutral	 However, they close you off from exploring the continent that is other music providers.
263_ 0	neutral	I used to work with t-mobile..
215_ 4	neutral	Also if you want to purchase music, its just .79cents per track ..... Here is my origianl review...." My wife already had the Ipod Mini when I purchased this, and I must say seeing it in action, I had some reservations about getting a Zen.
211_ 4	neutral	3It's been dropped, shuffled, kicked, and Lumbered.
287_ 34	neutral	(Intructions for doing so are on Symantecs website.)
132_ 206	neutral	Why would they let anything compete with them when they are making millions from song downloads by iPod owners who have no other choice?
288_ 2	negative	The program brings more problems than a virus, albeit not as major problems, just not what you expect for 70 bucks.
132_ 208	neutral	 And if they treat their customers like herding sheep, I see little reason to purchase another MP3 player with a bitten apple embroidered on it.
217_ 2	neutral	Finally, someone has figured out that building some smarts into the player will help it compete with iPods.
225_ 20	positive	The greatest thing about the software (in my humble) is that it reads your CD info.
0_ 146	positive	This camera is an excellent choice for an ultracompact, take anywhere device and boasts an outstanding movie mode to boot.
225_ 62	neutral	There are do it yourself sites (with pictures)that show you how to repair it, but keep in mind that you will have to break the warranty seal, which means?
166_ 37	neutral	You are really the ones that need this the most.
132_ 433	neutral	 Pros Holds a ton of music.
93_ 7	positive	We've never experienced odor from the pail.
101_ 4	negative	The collet for the 1/4 inch bits is a pain to get in and even harder to get out.
268_ 6	neutral	For the linux users out there who are intrested in my setup: I'm running Debian (Knoppix 3.4) with a custom 2.6.7 kernel.
132_ 387	neutral	Just don't drop it.
12_ 1	neutral	A 2X optical zoom (you can pretty much ignore any time a  manufacturer refers to "digital zoom")
184_ 4	positive	I love how small the thing is, and the blue glow - I've had it for two weeks with no electronic problems at all.
0_ 118	neutral	The first time, I paid $165 (excluding shipping) to have it fixed by Canon Service Center.
175_ 7	neutral	But if you want to get into networking and running wireless.
79_ 22	negative	The other pail I used started to smell after 2 weeks of use.
128_ 4	neutral	It works well with the larger bits.
241_ 11	positive	If you love your cell phone games or changing your ring tones everyday, Nokia beats everyone else.
212_ 11	neutral	They are bold colors, not the (personally) irratating toned down 'light' Ipod colors.
0_ 187	neutral	The Fujifilm F10 is probably the best compact camera for low light (ISO 400 with not much noise, even ISO 800 is relative good).
132_ 80	neutral	 The best thing for anyone to do who has not used one is to ask the store clerk at apple or a teenager for advice on how to operate it.
58_ 5	positive	3. It never smelled - at all.
3_ 15	neutral	Very wrong.
168_ 2	negative	I tried to do this by instinct and it's not intuitive unless you are a network geek.
239_ 2	neutral	Bought a bluetooth headset and it works like a wonder.
238_ 1	positive	since then, i have not found one major problem with it.
132_ 398	neutral	I guess that's a pretty minor deal, but it can be annoying.
231_ 6	positive	This is the first phone I know of that has the large bright screen, infrared, bluetooth, USB connector and a speakerphone.
255_ 6	neutral	I've synched it with my Jabra 250 bluetooth headset.
83_ 1	positive	Personally, I am VERY pleased with the Diaper Champ.
303_ 0	neutral	Product is OK; however, despite the fact that I followed the rebate instructions explicitly, I am being denied the rebate because the processing agency incorrectly claims I did not send in proof of ownership of a previous product.
166_ 62	neutral	You can prevent any, and all file transfers to your PC.
298_ 5	neutral	I agree with the other reviewer that it doesn't even deserve 1 star.
35_ 14	positive	The panorama modes are wonderful.
89_ 17	neutral	In talking with other parents, I get the same feedback - as babies get older and become toddlers, ALL DIAPER PAILS become gradually less and less effective until they are just no longer useful.
268_ 18	negative	I will say that the OS that the phone runs does have a few issues.
209_ 7	positive	Before you run out and buy an iPod, understand something: there are REASONS the Zen is worth encountering this kind of hassle, principally excellent (for MP3) sound quality.
99_ 2	positive	I actually took a friends word on it and went with this Champ when registering and I am glad I did.
7_ 3	positive	Hate to wait between shots
189_ 35	neutral	This is what I do:  I copy all the music I want to import to the Zen Micro into an iTunes play list.
132_ 196	negative	  The thing has survived plenty of falls with little or no damage, except the inevitable scratches.
84_ 0	positive	This is a great diaper pail.
149_ 5	neutral	Very disappointing.
165_ 0	neutral	Years ago I had an old Linksys router that I never could get to work right.
132_ 394	neutral	  The major change from the previous model, other than the extra 5G for the same price, is that this one is slightly smaller and lighter, and the already minimal buttons (menu, play/pause, forward and back) have now been assigned to the four quarters of the click wheel, so that even less brain power is required to search through your 10,000 stolen mp3s.
200_ 2	negative	Many other reviewers are mentioning that they have had no problems at all> I would say that the main problem is that this player is just not made very well.
117_ 2	positive	I have a tendency to do quite a bit of research before I drop money on a tool and everyone I talked to loved this router.
132_ 390	neutral	 Then I had the second one in my boyfriend's car, and his car got jacked.
208_ 2	neutral	After reading reviews and talking to a few friends, I decided on the Zen.
60_ 4	negative	The Diaper Genie needs it's own refill bags in order to work and that's just more money that you don't have to spend.
193_ 25	neutral	Immediately you could tell a very distinct difference between the two Creative MP3 players.
243_ 40	neutral	You will also hard-reset both your Palm and your Nokia to factory defaults in their lame attempts to get the script to work, though it will not.
55_ 0	neutral	In concept, it's a fabulous idea.
49_ 4	positive	The pictures are beautiful, and the camera is so small you can carry it anywhere.
139_ 18	neutral	However, if you are not a tech person and!
250_ 14	negative	Speaker volume is loud and clear but it sacrifaces the battery life.
279_ 2	positive	You can turn this phone into a gaming machine, a camcorder or a digital camera, an mp3-player, a movie viewer, a voice recorder, a personal secretary, a GPS map browser, a book, a multifunction remote controller, practically everything that you can do with the computer, plus it is a phone(!!) and also you can carry it in your pocket :).
287_ 19	negative	Almost from the beginning, LiveUpdate would not function.
69_ 3	positive	THIS ITEM IS EXCEPTIONAL I like the ease of use and it held the odor in great.
35_ 8	negative	For example, in auto mode you can't use the flash redeye reduction, you must be in manual mode for that.
242_ 45	negative	The second piece of advice - Be prepared to spend a lot of time w/ this phone.
132_ 408	negative	First of all, I've never been big on earbuds - they're just not that comfortable.
298_ 10	negative	Norton support is completely pathetic.
0_ 114	positive	I love the rounded edges now, fits so much better in a pocket, jeans or suit.
0_ 46	neutral	Camera has been treated with kid gloves since day one.
199_ 8	neutral	My preference for the touchpad sensitivity setting is 'medium'.
134_ 0	neutral	It's probably a fine router, but I found the install wizard to be of poor quality.
201_ 25	positive	Overall, the Micro is a solid device and I haven't fell into a problem with it yet *knocks on wood*.
287_ 6	negative	The antivirus feature is phenomenal, and is regularly updated.
136_ 7	positive	This setup using the CD was about as easy as learning how to open a refrigerator door for the first time.
153_ 2	positive	The main advantage of this system over its predecessor is the ability to open a wider pipeline between clients.
209_ 18	neutral	Something about the pictures suggests a deck-of-cards size, but you can hide the Micro completely under a standard business card.
3_ 2	neutral	I take it with me everywhere,literally,
0_ 31	positive	The Canon is very small, definitely pocket size, but still easy to hold firmly.
28_ 3	neutral	I said, can your fancy camera do that?
209_ 2	neutral	Why, troubleshooting, mediating software conflicts, devising workarounds, and when things got too bizarre, even calling tech support.
136_ 33	neutral	Follow the directions exactly.
132_ 167	positive	Everything I Wanted! The Apple iPod has become one of the most sought-after electronic gadgets - and for good reason.
132_ 249	positive	 And, with the iPods' full volume up, all you have to do is adjust your receivers' volume and your set, since the iPod itself acts as a strong amplifer of its' own.
287_ 43	neutral	No longer.
206_ 2	neutral	Of all the players that I have owned in the past (6 of them), all of them have had drawbacks and problems.
233_ 43	neutral	gee anyways ENJOY WHAT WORKS!
124_ 3	neutral	The Hitachi, on the other hand has a beautiful large flat edge to run against a guide, and the sub-base is recessed so as not to interfere.
140_ 9	neutral	No hold time.
0_ 198	neutral	To limit lag time, turn off flash or if flash needed, turn off display.
178_ 5	neutral	Though admittedly I am a novice at networking, I am not an idiot and can read directions.
249_ 3	positive	I can use it as a modem for my computer, connect with clients and friends, the possibilities are endless.
291_ 6	negative	The customer support is pathetic.
132_ 52	neutral	This 20 gigabyte iPod by Apple Computer allows you to put up to 5000 songs onto it, in a choice of digital formats.  MP3, AAC, etc.
132_ 7	negative	 It has an equalizer, but the iRiver H10-20GB has a lot more presets than the iPod.
190_ 5	neutral	I decided to go with the convienence factor and purchase a creative zen micro.
132_ 429	positive	 Overall, this product is AWESOME.
151_ 8	positive	Overall, this router seems like a reasonably priced product th!
213_ 4	neutral	anyway, here's the pros and cons:  +linux compatible with the 1.x series of firmware.
217_ 16	neutral	I'm not professing to be a consumer-survey corporation, but I don't know *anyone* with an iTunes account.
79_ 26	positive	Let the Champ win you over!
87_ 1	positive	It works great.
256_ 8	neutral	Why have the function if you can't film anything longer than e few seconds?
166_ 58	neutral	My last topic concerns the security setup you do, or have done with your router.
186_ 14	positive	The package also comes with a USB cable, an AC adapter, a pair of headphones (they're okay until you get a better pair), a stand, and a microfiber pouch to carry your Zen Touch in.
233_ 0	neutral	Its been 11 months now that I've held on to my Nokia 6600 for.
132_ 492	neutral	 It's small and lightweight, but it has very little storage space and the shape is clunky.
132_ 182	positive	ITunes can be downloaded from the enclosed CD or for free from the Apple site.
299_ 7	neutral	It did find Outlook Express, but that's not what I use.
232_ 1	negative	3660 had similar features, but that is big in size.
240_ 10	positive	Few month ago, it's very popular among my community.
225_ 45	negative	because the "engineers" at Creative screwed up the design of the headphone jack.
178_ 16	neutral	Anyway, after learning that the "Speedboost" feature only does anything for you if (1) you are also using a Speedboost adapter (which I was), and (2) if you are transferring large data files between computers (Note: it does NOT increase your speed on the Internet, but only between computers on the network), I opted to return the product and get the standard Wireless G (v.5).
311_ 11	negative	I see many other reviews that say the same....stay away from Norton, they don't deserve you, or anyone!
0_ 61	positive	Audio is mono and fairly acceptable, quiet also with little distortions.
183_ 29	neutral	3.
183_ 40	negative	IRiver has a better FM receiver built in, but the drawback to IRiver products is they are flimsy and poorly constructed.
208_ 14	neutral	I haven't used the Organizer feature (apparantly you can sync with Outlook).
115_ 4	negative	Shortly after I brought it, the plunging shafts started sticking.
132_ 348	neutral	 I was shopping for a MP3 player recently, and had the opportunity to play with my cousin's 20GB iPod at some length to see how I liked it.
131_ 16	negative	The electronic speed control is not doing it's job and the router begins to speed up and slow down at will.
132_ 282	neutral	  THE PROS  The bad ends here, because as far as I'm concerned the rest of...well...everything concering the iPod is an enormous PLUS!
192_ 16	negative	- Not compatible with Audible.com books.
0_ 69	neutral	But if you want a pocket camera to use when you cant take your Digital SLR with you that will capture quality images this is your choice of camera.
124_ 4	positive	The power is incredible, it cut through MDF and plywood like butter.
0_ 189	neutral	For me the colors of the Casio-cameras (Z750, Z50)aren't by far as good as that of the SD500, the pictures looks more artificial and over processed.
32_ 16	neutral	Another is the ability to upload images from your PC to a memory  card in the camera.
113_ 5	positive	The handles make it very comfortable to use and I experience little vibration.
249_ 4	positive	The ringtones are beautiful, the screen is super high quality.
166_ 15	neutral	Of course your data, and installed programs are gone if you do that.
132_ 358	neutral	 I disagree.
228_ 0	neutral	Nobody has clearly articulated what exactly about the Ipod mini makes it better than this product.
29_ 3	positive	This is a great product, and Canon has done an excellent job.
225_ 31	neutral	Once I did this, visions of burning my CDs-literally-dance around my head, and all was right in the world (of course, I would have backed my files up, silly).
124_ 7	positive	I do not count this as a negative, however, because it is not that much of a nuisance and at the price for what you get this router is way too good to pass up!!!
242_ 43	positive	There are number of downloads needed/available for this phone & they will be texted to you at no cost.
243_ 38	neutral	The supervisor stated that it must have been third-party applications on the 6600 that caused the 3650 to break, and would not take the suggestion that his own tier-2 technicians stated that it was not possible to back up the 6600 to the 3650 without damaging the 3650, regardless of what was or was not on the 6600.
139_ 6	positive	I have had mine for about a year and use a third party firmware on mine and love it.
100_ 18	neutral	It takes all of 2 minutes, if that.  4.
312_ 2	neutral	It seems like Symantec did a lousy job on this version.
67_ 5	negative	But, sometimes, if the Champ is too full, the flip handle won't function.
302_ 1	neutral	Some of the options are confusing, especially when the popup warnings occur, but I've had no problems with intrusions.
307_ 10	neutral	And this despite the fact that I'm not even using AntiSpam.
132_ 293	neutral	 But really, EVERYONE I've seen with an iPod leaves them off.
132_ 365	neutral	 Since no company has yet to come out with an interchangeable battery for the jukebox-sized players (the Creative Labs Zen Micro is the only one I'm aware of that has this, and it's 5 GB), this can be an issue.
253_ 8	positive	In short, the Nokia 6600 is an evolution but not a revolution.
132_ 345	negative	However, in my mind, $299 is a lot to pay for a device that will only last 18 MONTHS.
251_ 8	negative	3- It is SLOW , if you keep the original configuration and progs (why'd u buy it then ?!) it'll run smoothly , but still slower than most other coloured-screen Nokias .
221_ 11	neutral	Apple has tried to hide something from you: most people don't actually need more than a few gigs at most.
166_ 34	neutral	With wireless routers, you have another potential hole, "the wireless connection".
132_ 329	neutral	 Organizing music is a breeze too.
207_ 16	neutral	My PC is running Windows 98 though....maybe having old outdated things is a good thing for once!
220_ 3	positive	The sound is bright and clear, the ability to store any MP3's (and not just Apple-approved files) is great, and I plan to make use of the storage space and sound recording from time to time.
100_ 3	positive	In fact, I liked it so much after using it with my son who is now 2 years old, that I bought one for our new baby's room.
256_ 16	neutral	But beware of the bugs; they are major!
318_ 3	positive	I upgraded from NIS 2003, and the change in performance has not been noticeable.
132_ 391	neutral	Fortunately his insurance covered it (also extraordinary), and as luck would have it, this new gen of iPods came out the same week he got the check.
306_ 15	negative	They didn't know what the problem could be.
132_ 389	neutral	 Actually I had two: the first one stopped working within a month so I took it back, and they exchanged it (which is evidently pretty extraordinary - guess I lucked out.  I didn't tell them I had dropped it once).
36_ 10	positive	4- Looks great.
285_ 0	positive	I'm not sure why all the bad reviews, my computer isn't especially slowed down and I have Win'98.
0_ 22	positive	They say that they are the best pictures they have ever see from a compact.
38_ 1	positive	This camera is great, wonderfully small, and has attactive hi-tech casing.
307_ 3	negative	You can "disable" some of the individual components, but don't be fooled--they're still there and running.
0_ 202	neutral	Check out the other professional reviews for this camera on the web.
80_ 4	positive	I use the regular kitchen trash bags and it is so easy to empty.
189_ 12	neutral	1.
132_ 191	neutral	 Wow... just less than 15 minutes and the back of it already has a scratch!
214_ 16	neutral	One was the firmware upgrading from the installation CD and the second was regarding the "playforsure" (even though it's in BETA), to make sure I could use Napster 2 Go.
132_ 405	neutral	But seriously though, how bout we work on the durability thing for the next gen.
15_ 8	negative	The digital zoom is crap.
281_ 3	neutral	I am thankful that I have Roxio GOBACK, I had to use it 3 of the 4 times.
1_ 4	negative	I have to move pictures off of it every day so I have room for more pictures the next, and I don't have enough money to buy the 256 MEG card that I've had my eye on for a while.
132_ 92	neutral	This is a great device, but there are its pros and cons.
147_ 4	negative	That is, you cannot access the internet at all.
100_ 11	positive	So much safer than the others that require a two handed operation!
76_ 2	neutral	I have heard that it will eventually become my sons favorite place to put his toys when he becomes a toddler, but I've got 2 years to worry about that and I'm sure I'll figure out preventative measures like any other mom.
174_ 17	neutral	Best practice is learn how to setup encryption.
142_ 6	neutral	After countless attempts at recycling the modem and WPA keys etc.
274_ 12	neutral	Looks big in the display ads though.
312_ 8	positive	I've tried the free versions of zone alarm and the free version of sygate and they both have a nice and easy installation and work great!.
132_ 392	neutral	  So I got a free 5G upgrade out of that misfortune.
125_ 8	positive	I've got a buddy who's trying to offload his almost new $300 Speedmatic because he saw what this router can do.
215_ 15	positive	BUY THE ZEN!"
132_ 77	neutral	Very Pleased.
132_ 110	neutral	Get an ARCHOS Gmini400 instead  If you are doing your research and thinking whether iPod is right for you...      give the ARCHOS Gmini400 a look.
