ID	SENTIMENT	TEXT
141_ 1	positive	This linksys router does it for the RIGHT PRICE.
201_ 30	positive	Colors: 10 variety of HOT colors made it difficult to choose from.
91_ 8	neutral	However, for the previous 13 months-this is what I encountered - PROS -
106_ 14	neutral	This will allow operation of the power switch with the left index finger and the plunge lock with the left thumb (instead of the standard right thumb and right index finger, respectively), but then the depth scale is on the back face of the router, as is the straight edge of the base plate.
169_ 11	positive	My Xbox connection seems as good as with a cable.
132_ 298	positive	 With the iPod, you can also store documents and contact files (from programs such as Microsoft Outlook) when it's connected to your PC as an external hard drive.
11_ 0	positive	I've been incredibly happy with this camera.
221_ 9	positive	Your choice of ten colors in a beatiful package.
118_ 5	positive	You'll love it!
109_ 3	negative	I find that if you remove the springs it is much easier to adjust and will not stick much.
140_ 12	neutral	I was told to connect my computer directly to the cable modem, then go to a Linksys webs!
154_ 1	positive	My experience with installation was quite good.
166_ 32	neutral	These generally range from not connecting at all, to hosting !
47_ 0	neutral	I've struggled for years with supposedly high-quality point and shoot 35mm cameras delivering astonishingly inconsistent results.
183_ 35	neutral	Some other companies require you to send your player back and then charge you an additional $130 to replace their batteries.
132_ 437	positive	 Has a great helpline.
195_ 37	neutral	Creative has not lounched any silicon cover for the player like ipod's (I think belkin makes it for ipod).
116_ 6	positive	The guide fence for freehand routing is well made and solid.
281_ 9	negative	Being a past Norton customer, I consider this to be a slap to my face.
308_ 0	neutral	I bought Norton Internet Security years ago when it first came out.
262_ 1	positive	Im able to keep my phone on for about a week (mostly stand by) to three days (regular use)
71_ 1	neutral	As a first-time mom, I got the great idea that cloth would be better, and this was the only diaper disposal that advertised compatibility with cloth diapers.
139_ 9	neutral	P2P is just harsh on networking equipment of!
119_ 2	neutral	I have added the router raizer kit(simple installation) to it and cannot live without this setup!
287_ 5	neutral	It has saved my system on more than one occasion, and makes disc clean up a snap.
196_ 14	positive	Also, I am quite partial to the Creative MediaSource Organizer and Player software, which I had with Audigy ZS sound card originally; it is definitely an added plus.
166_ 52	neutral	Moreover, the price of these is very low compared to most computer add-ons, so getting the added functionality is at little, and sometimes no cost.
205_ 13	positive	Also, the touchpad seems to be waterproof to some degree.
217_ 4	neutral	At this point, the Rio Carbon is 5Gb (along with a host of South Korean manufacturers), and eventually the iPod will get a "free" upgrade to 5Gb as the 4Gb trickle down to nothing.
206_ 18	negative	00% good though, and the Zen does have a few drawbacks.
83_ 7	neutral	I am SO thankful I got that advice when I did because I had the Diaper Genie on my registry aforementioned to her warning.
199_ 17	negative	If I was pressed to find a negative aspect of the Zen Micro I would probably have to mention weak FM reception, but the building where I primarily use the Micro seems to have a history of terrible radio reception anyway, so you can take that for what it's worth.
270_ 7	negative	My fingers are kind of stubby so it took a while to learn how to hit a key without hitting the adjacent ones.
213_ 10	positive	+Sorts music by artist, album, genre, etc... it's easy to wade through 5 gigs of tunes to find what you're looking for.
321_ 1	negative	This program would not let me send Outlook Email or listen to Audible sample books online.
139_ 0	neutral	Here is the big news to everyone; this is a consumer level product.
69_ 1	neutral	Everytime I tried to unload it the sausage links(as I call them) would unravel and I think the odor control was only so so.
201_ 7	positive	When I opened the box, I was shocked by the size of this thing... It's TINY!
211_ 7	neutral	All of my files are mp3 or wma, Windows Media Player is my primary music suite, i use it to burn, play, rip, and sync.
3_ 0	positive	I bought this camera for the same reason many of you are considering it, or have already bought it--it's size.
287_ 24	neutral	Without updated virus definiations, your PC is also at serious risk!
242_ 28	neutral	This is no small deal.
252_ 2	positive	It is Nokia and thus easy to acces the menu options.
110_ 2	neutral	Before buying this I read others reviews and of the complaints I read about....well I have not experienced any.
267_ 0	positive	I got a 1GB MMC upgrade for this phone and now I can:
132_ 491	neutral	Not perfect, but I'm still enamored...  I've had an iRiver MP3 player for a year or so now, and it's really great for listening to the radio.
70_ 1	positive	It holds a lot of diapers, not to mention the odor!
132_ 274	neutral	 The problem with this is that a) it takes a LOT of time if you have many files and b) audio quality is somewhat lost (if you're an audiophile, this will bother you - frankly, I can't tell the difference).
179_ 1	neutral	Coverage in my 2-floor brick-walled house was poor and erratic.
111_ 6	positive	It is no more heavy than any other powerful router and not as bad as some Porter Cable models I tried.
132_ 243	neutral	 Still my favorite MP3 player  Is it overpriced ?
250_ 8	neutral	This feature is very important to me as I make a lot of international calls.
307_ 12	negative	Sure they say if it's their fault you won't get charged, but THEY are the ones who get to decide whether it's their fault.
221_ 26	neutral	Do NOT buy Apple.
139_ 25	positive	I would highly recommend that you do this if you want to learn something, but if you are not interested in learning this stuff and just want a working wireless router, just get the WRT54G.
39_ 5	positive	This is enough capacity and capability to do a complete household inventory, for example.
132_ 149	neutral	then when i argued with them they told me that they would pick it up.
259_ 1	negative	They have the worst service of any of the major companies.
246_ 1	negative	It's important that people know the following:  First, the interface is slow.
246_ 2	negative	You hit the message button on the front and it takes a matter of SECONDS to bring up the menu.
270_ 12	positive	It's really well made and has survived sliding across floors and pavement without a scratch.
222_ 0	neutral	I must say, after tons of research, I have chosen the right Mp3 player.
0_ 111	positive	I still can't believe how fast it starts up.
220_ 1	neutral	these are the things I was curious about when I was shopping around.
300_ 0	negative	Before installing anything on your computer, you need to do a bit of research before spending the money.
320_ 4	neutral	In "Add/Remove, you must selecting the program's Change button.
0_ 0	positive	We really enjoyed shooting with the Canon PowerShot SD500.
265_ 8	positive	On the T-Mobile service I was able to take pics as we drove across I-70 and email them to family & friends once we reached a T-Mobile tzone (usually a major city).
224_ 8	negative	I sent Creative customer service 3 emails in which they did not help me one bit and don't seem to even want to help.
147_ 5	neutral	All lights blink, and you can still access other computers on wired and wireless LAN.
137_ 6	positive	Comes with a installation CD which instructs you step by step to setting up the router.
25_ 1	positive	This camera is so light and tiny that I literally carry it everywhere with me, which is great considering I'm an artist and like to capture interesting items for future painting.
132_ 397	neutral	 When this happens I have to toggle the lock switch on and off to get it to work properly.
240_ 12	negative	But not good enough for me.
201_ 14	neutral	I expected this coming from Creative.
131_ 19	positive	For the person that uses the equipment every day, pay the extra and get a reliable & safer unit.
307_ 4	negative	Although I disabled Norton AntiSpam, it is still there.
192_ 4	positive	Pros: - Excellent sound, even with the headphones that come out of the box, but it absolutely rocked with my Bose Quietcomfort 2 set.
100_ 24	positive	Works great!!!!
266_ 5	positive	Overall the phones fantastic, and I would have given it 5 stars, but its not perfect.
132_ 444	positive	The I-Pod is the best thing I have ever used.
132_ 211	neutral	 If you listen to the iPod four hours per day and you get 10 hours per recharge cycle (not the full twelve specified by Apple) then the iPod will give you over 2.5 years of daily listening.
296_ 4	negative	So, DON'T buy this or upgrade.
66_ 2	neutral	My second child I didn't get any.
166_ 61	neutral	The other issue is how secure do you want it.
79_ 0	positive	The diaper champ is the best!
168_ 0	neutral	OK, I never read the manual.
134_ 11	neutral	It turns out to be copyright 2002 and much inferior to the 2005 manual included on the CD.
36_ 4	positive	I've had a lot of cameras, but this one is ACTUALLY being used, and not stored in a desk: it's allways in my shist pocket.
256_ 3	positive	Photos are pretty darned good!
0_ 81	positive	great picture quality - in automatic mode, quality is great.
153_ 4	neutral	If you are sharing a cable modem or DSL, it's probably not going to be noticeable.
116_ 8	negative	It's oftentimes hard to get a good grip on the router, activate the chuck lock, and get enough muscle behind the wrench to get the collet loosened up.
142_ 11	neutral	My ISP had me up and running within 5 minutes.
173_ 6	positive	Reset the network, tried the connection, and it's working like a charm.
322_ 1	neutral	I was using this on my 2001 Dell laptop (which worked fine until I upgraded to this junk!)
197_ 5	neutral	The karma also has a very long battery life.
197_ 1	negative	The iPod mini is smaller and sexier, albeit limited in supported formats and the Rio Karma is a far better value.
60_ 0	neutral	A MUST HAVE!
130_ 0	positive	This is a fantastic tool to use.
234_ 10	neutral	Sorry, try something else or at least trying using one.
72_ 1	positive	With the enormous numbers of diapers that you go through with a newborn, it was great how easy it was to dispose of the dirty ones.
205_ 5	positive	I'm not sure whether this is related to the charge cycle of its Li-Ion battery, the better firmware, or a combination of both factors.
162_ 0	neutral	I purchased the router and 1 Linksys WPC54G Wireless 54g PC Card.
170_ 6	neutral	VERY IMP.
82_ 4	neutral	The latch isn't terribly difficult, and I wouldn't want it to be too easy since it sits in my son's room.
268_ 27	negative	It takes a while to learn how to use it right, and at this point I am able to make about 70% of my calls using it.
149_ 0	neutral	I bought this in order to upgrade from an old 802.11b router to g technology, and I spent several hours trying to get it to work.
254_ 4	positive	A huge beautiful color screen which can not been scratched at all even with the rough handling i give it.
0_ 43	neutral	I have had the SD500 for less than one week.
269_ 0	positive	I really love this phone...
100_ 14	neutral	He thinks it is magic when the diaper "disappears".
264_ 5	neutral	Depending on the timing of the postmark date, you don't get your second bill until the postmark date passes, so it's impossible to qualify for the rebate.
6_ 1	positive	It will not replace your high-end 35mm SLR but it's a great toy to keep near you at all times for snapshots.
0_ 97	positive	if you'll only read the whole manual, you'll find out even more cool features and you'll learn how to manipulate the quality you want to achieve and all those modes will make sense after reading
138_ 18	positive	Overall, if you know what basic steps to take, it was not difficult to connect, and the s/w worked well to connect.
123_ 4	negative	My son tried it and he too couldn't change the speed without an assist.
254_ 3	positive	Get great themes and wallpapers for this phone and many many polyphonic rings.
36_ 15	positive	Don't care about sunlight: it's TFT.
188_ 7	neutral	in principle playlists, album names, artist names, etc would help you organize but this only works IF your tracks have all the necessary data; mine do not.
0_ 29	positive	Sharper pictures.
185_ 6	neutral	The reason why I didn't give the Zen Micro 5 stars is that they also seem to want to conform the the Ipod sense of style.
323_ 7	negative	Is it necessary to scan my MS Money database when I close the program?
135_ 3	neutral	(The Airport was more than twice the Linksys router.)
176_ 1	positive	I downloaded and updated the firmware, and followed the easy setup instructions.
86_ 0	negative	I registered for this item because of the good reviews it got, however I was not impressed.
132_ 479	neutral	 Although iPods have been around for a few years, they didn't really get hot until now.
306_ 9	negative	My file log was not responding and the program was not blocking any cookies or unauthorized sites.
116_ 5	positive	Smooth plunging mechanism.
268_ 0	positive	This is the first cell phone I've owned, and overall, I am quite pleased with it.
191_ 24	positive	I have not yet used all the features, like the calendar, etc, but as a music player this little thing rocks.
132_ 210	neutral	 The iPod batteries can go through a full recharge cycle 400 times.
36_ 9	neutral	2 secs to download a 600KB 1600x1200 picture!
207_ 22	negative	My other nit is that it didn't include at least some kind of carrying case for everything.
113_ 1	neutral	She told me to take a look at it, and after reading reviews here and at other sites, I told her to get it.
110_ 5	positive	I would put the Hitachi up with the best!
115_ 6	negative	I no longer use it as a plunge router, only as a stationary or table mounted router.
132_ 189	neutral	 Highly recommended for people who like to listen to music or audio books on the go.
132_ 171	neutral	This version does not come with a dock, although it can be added later as an accessory.  Y
117_ 7	positive	They were easy to setup with plenty of power to hog through anything I have encountered.
295_ 0	negative	Even though I have the parental controls off it constantly starts updating them then freezes my computer.
44_ 1	neutral	Thank you Santa!
132_ 276	neutral	 If this sounds confusing, just make sure you have your iPod plugged in when you install the iTunes software!
183_ 22	negative	I took my Zen Micro with me over the weekend, and was forced to lug my laptop with me on the trip for one reason: to keep the Zen Micro charged.
132_ 411	neutral	 And I'm really not that rough with things!
132_ 477	neutral	 I would strongly recommend you get one !!
183_ 43	positive	) The Zen Micro appears sturdy and well constructed, hefty, if you will, far better than many of its competitors. .
220_ 7	neutral	instead of an iPod (I know this is a tediously recurring theme in these reviews, but I want to get my two cents in) was the FM radio.
259_ 4	neutral	T-Mobile's minute plans are cheaper for a reason.
136_ 22	positive	I hooked the Linksys wireless router up to a broadband connection which is running at a maximum of 700 plus Kilobytes on the download e!
171_ 0	neutral	I have two linksys routers, one wireless g, and the other cabled.
201_ 8	positive	It's shorter, sleeker, more compact and fits comfortably in my small hand than the iPod...My Nokia cell phone towers over this bad boy!
65_ 0	neutral	We received this diaper pail as a gift while expecting our second child.
201_ 11	neutral	:) I was also happy that my shipment came with all the accessories (minus extra battery).
215_ 5	positive	However after playing with it for three weeks now, I'm convinced, the Zen Micro is superior.
227_ 11	neutral	Use Windows Media Player 10 to do your transferring.
242_ 33	negative	The 6600 will provide similar service in more developed areas of The States and not as well in more remote areas.
229_ 8	positive	sending the unit to the company of purchase which costs about $90), the ability to record with a built-in microphone (great for recording reminders and meetings), very sturdy construction, and not to mention...the sound quality is excellent!
68_ 2	neutral	It was such a pain to use.
168_ 4	neutral	When I gave up and called their help desk, they sent me to a web site, I ran a program and viola - I was on the net wirelessly.
154_ 12	positive	I have had no problem either with backward compatiaibility, in that the "mixed mode" feature lets you both 54 and 11 Mb cards off the router.
257_ 0	neutral	What I have found useful to consider before purchasing a phone:  - decent battery life - good call quality - user-friendly interface - camera/video functions - bluetooth - ability to sync contacts stored in the PC with the phone (no more manual entries!)
268_ 20	negative	Especially the bluetooth server... Meaning you have to restart the phone if you want bluetooth to work again.
3_ 6	positive	The picture quality of this camera is outstanding (taking its' size and price into consideration).
125_ 2	positive	The ones I've kept (Porter Cables, Dewalts, Bosch, and this Hitachi) have proven their worth over the years, however, when I need a real workhorse, I grab this router.
307_ 0	neutral	NIS is a package of several Norton products.
188_ 4	positive	The good news is that the creative support is very responsive and after some emails and postal exchanges, i had a new zen.
0_ 57	positive	The pictures are tack sharp, colors are vivid, and at 7 mega pixels the quality is plenty high to manipulate and crop images to your hearts desire.
132_ 525	neutral	 But is it worth all the hype?
183_ 7	negative	Who wants to go through the hassles of loading software onto a "foreign" computer just to move over some simple (*.txt) files?
132_ 481	positive	I love the features on the iPod and the many things you can do with it.
116_ 0	positive	I love the performance and features of this router.
132_ 22	negative	 There is also no voice recording, something most if not all MP3 players have that the iPod doesn't.
217_ 9	neutral	The scroll wheel is not an Apple innovation, but it took Apple to put it on their MP3 player for the obvious to become clear to the industry.
206_ 11	positive	Everything that I have listed above, the Zen has, and more.
259_ 2	negative	I really regret signing up with T-Mobile, but I'm stuck with them for the next 6 months of the contract.
319_ 1	positive	The program is fully featured, with much of what you'd want from a security program --
187_ 11	positive	The touch buttons are textured so that your finger sdon't slip which was very thoughtful.
132_ 198	neutral	However, it fell into one of Apple's worst reputations.
242_ 23	positive	MEMORY/STORAGE - Seemingly boundless.
166_ 25	neutral	Networks on the outside can't see your computer, and unless you install the security protocols incorrectly, all they see is the router, and what can't be seen can't be accessed.
31_ 15	neutral	By the time the shot's taken, something (especially a squirmy child or a sports play) has invariably moved and it's not the exact picture you wanted.
132_ 262	neutral	  THE CONS OF THE IPOD  There are a few advantages to the Nitrus.
278_ 7	positive	it has a handsfree loudspeaker, conference and transfer!
132_ 47	neutral	 the 20 gig because that holds 10,000 songs right there and that's alot of songs.
32_ 5	positive	First, it really is tiny; the size of a pack of cigarettes, maybe  a scooch deeper.
243_ 22	neutral	So, after all this frustration of adding all of my newest contacts to the 6600, I asked the technician if it were possible to transfer the data from the 6600 to the 3650.
57_ 1	neutral	Having one of these helps from needing to take out the trash daily for the guys!
132_ 502	positive	  The click wheel is incredibly convenient, however it can be a little overly touchy at times, which will make you frustrated with your own fingers.
0_ 196	positive	The manual is excellent.
39_ 6	neutral	While this might seem pricy, I have been spending $27 for 25 APS images, with prints and a CD, so this camera will pay for itself in a year.
132_ 355	negative	The biggest red flag for me was the fact that although my cousin's player was relatively new, it was riddled with scratches.
73_ 4	positive	*holds a LOT of diapers--a full week of toddler diapers!
170_ 12	positive	It works well with my VOIP adapter, which is also a Linksys.
201_ 20	positive	There are extra features packed inside this unit (some that most will hardly ever use) such as FM radio tuner, voice recorder, calendar, and alarm clock.
80_ 3	positive	No need for deodorizers.
178_ 14	neutral	I did this and indeed the setup flowed much better.
243_ 1	neutral	In October of 2003, I bought a Nokia 3650 off of eBay.
179_ 3	neutral	Two walls apart from it, the signal would start failing.
0_ 157	neutral	If you want one you better hurry up - supply is low and demand is high which means prices may go way up!
21_ 2	neutral	The  ELPH will do the latter but you must hold down the shutter button to view  it.
132_ 366	neutral	IN SUMMARY: This is a good, basic player.  It's not for everyone, and if you're in the market for one I suggest that you try to put aside the huge popularity of the iPod and look harshly at the actual features that the other players on the market have, and see how they stack up.
91_ 15	neutral	My toddler thought rotating the  top was fun-he always wanted to play with it
65_ 5	neutral	Any diaper pail, if you leave it for long enough, is going to smell.
214_ 10	neutral	So I decided on the black one.
132_ 89	negative	 One caveat I have is that I understand the iPod does not save the photos in such a way that the quality of the image is preserved.
195_ 9	positive	You can use the player to store your computer data files (Good feature to have).
324_ 1	negative	Start up, log off, log on...everything became very slow.
243_ 10	negative	BLUETOOTH DOES NOT WORK ON THIS PHONE.
227_ 18	neutral	These issues knock a single star off the review.
3_ 25	negative	it's not my first choice in cameras,
150_ 3	neutral	If you buy, you should disable the SSID Broadcast, use MAC filtering and deploy some form of encryption (multiple choices)if you want to ensure your network is secure (all covered off in the manual).
254_ 1	positive	You can take pic of your friends and the picture will pop up when they call.
142_ 12	neutral	Also some ISP's give you a discount if you supply your own modem.
287_ 31	positive	Their website had a download that helped remove those, although I had to manually remove a good number of files from the "Programs" directory.
66_ 7	positive	It's also so easy to use and holds a great deal of diapers.
223_ 3	positive	it's a great looking, easy-to-use device but it's the sound quality which is truly amazing -- far better than my Sony mini-disc player.
148_ 0	neutral	I replaced my D-link 802.11b router because it could not hold a connection continuously.
132_ 415	negative	  And if you're a Mac user like me, they've naturally made sure you have no viable alternative.
32_ 13	neutral	But otherwise I am thrilled to have taken the plunge into digital  photography.
209_ 0	neutral	I would give the Creative Zen Micro five stars without hesitation...except for the eight hours of my life I can never get back.
20_ 0	positive	I got this camera for an unbelievably low price at amazon.
212_ 5	negative	After research of other creative hard drive players, i found that most of them aren't very durable and tend to crash (read most reviews on amazon.com and see for yourself).
219_ 2	neutral	Check out message boards on Napster for more info.
94_ 0	positive	Excellent diaper disposal unit.
153_ 5	positive	Linksys quality and tech support have been outstanding.
179_ 7	neutral	Firstly, I mounted the 7dbi antenna pair, replacing the original ones.
96_ 3	positive	While the perfect ordor free diaper pail has yet to be invented, the Diaper Champ is a good as it gets.
30_ 1	positive	I received this little jewel as a gift and I can honestly say Iabsolutely love it.
111_ 12	negative	I have noted that as you use the tool, sawdust builds in the channel and it requires attention.
140_ 0	neutral	I had a Linksys wired 802.11B router and wireless access point which worked well, but decided to upgrade to an all-in-one 11G device.
85_ 5	negative	The pluger gets stuck & you have to manually extract the mess.
108_ 10	negative	The plunge action isn't smooth unless you make it so.
118_ 1	neutral	This router does GREAT in hand held jobs and Router Tables.
0_ 195	neutral	I use "get ready" and "here it comes".
0_ 168	positive	Very good "every day" camera. Fits nicely in the pocket of my jeans and takes quality photos.
190_ 29	neutral	If you're an audiophile, you already know that mp3 players are far from impressive.
145_ 0	neutral	I got this inexpensive  router to let me connect two desktops and a Thinkpad laptop to my NTL broadband modem, instead of having to go through the hassle of rebooting the modem and connecting to a different PC, as and when needed.
136_ 15	positive	Pertaining to the speed issue: I got 54Mps while I was in the same room.
0_ 98	neutral	as a whole, i say, it's way more than what i expected.
213_ 11	neutral	Also provides for playlists which are nice, but really only usefully set up through the PC software.
3_ 13	negative	Another problem I had with this camera was the zoom function.
